date_iso,date_display,source,rating,rating_basis,sentiment,vader_compound,themes,title,job_title,location,employment,pros,cons,body,advice
2024-06-20,"Jun 20, 2024",Glassdoor,1.0,glassdoor_overall,negative,0.1027,Management & Leadership; Culture & Toxicity; Career Growth & Advancement; Turnover & Retention; Coworkers & Team; Meaningful / Patient Work,I feel compelled to be honest,Human rescources,,Current employee,The patients and members lives we get to change,"High turnover in all departments, corrupt leadership, unprofessional friendships that allow harassment, bullying and retaliation to flourish like wildfire. If you have other opportunities; take them. This is the highest turnover rate I have experienced in 10+ years of work experience",,
2024-06-27,"Jun 27, 2024",Glassdoor,1.0,glassdoor_overall,negative,-0.8632,Management & Leadership; Culture & Toxicity,"SAVE YOURSELF, DO NOT WORK HERE",Lead care manager,"San Diego, CA","Current employee, less than 1 year","Do not work here. HR department is trash. You cannot complain here without being thrown out the door or abused. The whole management here is absolute garbage, this is not a company BUT A JOKE. PLEASE SAVE YOURSELF. I am only giving 1 star, but want to put 0 STARS","Everything. Management. Managers/CEO do not care. HR department is full of favoritism, lack of leadership, ineffective management, toxic energy will leaving you feeling uncomfortable all the time. It's a toxic and hostile environment. Various people have complained about the department and nothing changed. CEO nor management care about having a positive work environment. Very SAD. DO NOT WORK HERE",,IMPROVE PLEASE. FIRE MANAGEMENT
2024-07-15,"Jul 15, 2024",Glassdoor,1.0,glassdoor_overall,negative,0.9128,Management & Leadership; Pay & Benefits; Workload & Burnout; Culture & Toxicity; Communication & Organization; Turnover & Retention,Toxic workplace environment,Lead care manager,,"Former employee, less than 1 year",None None None None None,Unprofessional management Lots of favoritism They allow anyone to be a manager and don’t take accountability whatsoever HR is a joke and the entire company needs to improve The pay and benefits are not worth the heavy workload I would not recommend this place to anyone who values their sanity and peace of,,Hire people who are equipped to be in a leadership role so you can build a solid foundation. There’s a reason no one stays at this job longer than a year and people are continuously quitting m
2024-07-19,"Jul 19, 2024",Glassdoor,1.0,glassdoor_overall,negative,-0.457,,yikes,Care coordinator,"San Diego, CA",Former employee,"none, nada. zero. sucks, worst",everything you can possibly imagine,,
2024-07-23,"Jul 23, 2024",Glassdoor,1.0,glassdoor_overall,negative,-0.5574,Management & Leadership; Pay & Benefits; Workload & Burnout; Culture & Toxicity; Meaningful / Patient Work; Flexibility & Schedule,Terrible Management,Mental health therapist,"San Diego, CA","Former employee, less than 1 year","Decent benefits, remote work and being of service to the clients",You will be overworked and burned out. The workplace became unbearable when the director of mental health left. The current managers are passive aggressive and unprofessional. The main focus for the company is on making money and not on the client or employee wellbeing,,
2024-09-17,"Sep 17, 2024",Indeed,1.0,indeed_topics,negative,0.9052,Management & Leadership; Workload & Burnout; Career Growth & Advancement; Training & Onboarding,"The work environment was mentally exhausting, with unrealistic expectations and a lack of support from management",Lead Care Manager,"San Diego, CA",,None,Your mental health,"My experience at SERENE HEALTH was unfortunately disappointing. The work environment was mentally exhausting, with unrealistic expectations and a lack of support from management. There was little regard for employee well-being, leading to high levels of stress and burnout. The company culture did not foster growth or positivity, and many employees, including myself, felt undervalued and overworked. I hope the company takes serious steps to improve how they treat their staff, as a healthy and supportive work environment is crucial for long-term success. San Diego office is a joke.",
2024-09-26,"Sep 26, 2024",Indeed,,none,negative,-0.7531,Management & Leadership; Workload & Burnout; Culture & Toxicity,Hostile work environment,Licensed Mental Health Professional,"Chicago, IL",,,,What is the best part of working at the company? Variety of behavioral health clientele What is the most stressful part about working at the company? Poor Management & Expansive caseloads What is the work environment and culture like at the company? Stressful work environment. Minimal diversity.,
2024-09-27,"Sep 27, 2024",Glassdoor,1.0,glassdoor_overall,negative,0.9681,Management & Leadership; Pay & Benefits; Culture & Toxicity; Communication & Organization; Turnover & Retention; Coworkers & Team,DO NOT WORK HERE,Lead care manager,"San Diego, CA","Former employee, less than 1 year",The pay is decent and you have a supportive team but that's the only support you'll receive,"Their turnover rate and employee retention are very poor, which should've been the first red flag. Female Supervisor A.I. is nice and sweet at first then after the first month, she is extremely condescending and passive-aggressive, not supportive at all. They give you more and more work, last minute work to complete with extremely unreasonable due date or notice. The supervisor does not support you and denies you when you try to advocate for yourself. Was given a task at 2:30pm and expected to complete by 5pm. I was a new hire and could not believe this is how they treat new hires after 2 months. They are constantly conducting interviews and people are quitting left and right, myself included. I wish I had never been associated with this company to begin with and I admire the LCMs who still work there",,
2024-11-11,"Nov 11, 2024",Indeed,1.0,indeed_topics,negative,0.0799,Management & Leadership; Micromanagement & Surveillance; Pay & Benefits; Career Growth & Advancement; Turnover & Retention,Micromanaging at its finest,ECM,"San Diego, CA",,Health benefits,Management,There are cameras in the offices monitoring you all day on top of micromanagement from supervisors. No room for growth and high turnover. The job is simple but makes it more difficult with someone watching over you at all times.,
2024-11-21,"Nov 21, 2024",Glassdoor,2.0,glassdoor_overall,negative,0.8885,Management & Leadership; Micromanagement & Surveillance; Culture & Toxicity; Career Growth & Advancement; Meaningful / Patient Work; Flexibility & Schedule,Don’t work here,Clinical care coordinator,"San Diego, CA","Current employee, less than 1 year",Quarterly Potlucks surrounding the holidays,"Micromanagement, petty leadership, false promises, overly strict working schedule (no flexibility). Negative Reinforcement, retaliative behavior, don’t encourage learning & collaboration. Don’t care about the patients",,Leadership should have an education requirement surrounding healthcare administration & how to promote a healthy work place
2024-12-03,"Dec 03, 2024",Glassdoor,2.0,glassdoor_overall,negative,0.9409,Management & Leadership; Micromanagement & Surveillance; Pay & Benefits; Culture & Toxicity; Training & Onboarding; Turnover & Retention; Coworkers & Team,"Not horrible, but a transitional job at best",Lead care manager,"San Diego, CA","Current employee, less than 1 year","we get to help poor people in San Diego -we help them coordinate their appointments, get resources for food, clothes, discounted utilities and anything we can find basically -team of LCMs is nice, friendships are forged here -pay is around $25/hr, which is really not horrible -festive on the holidays","Look I gave this 2 stars out of generosity because I appreciate being employed and getting a paycheck but here is my honest truth -people do not like working at this company, there is an incredibly high turn over rate -yet we are constantly told to ""stay positive"" and ""stop spreading negativity"" like we are the problem -the micromanagement is out of control, employees feel belittled and not respected -management is obsessed with the politics of the office, making it honestly kind of a toxic environment -some supervisors are literal bullies, drunk on power, and management supports it -we are not trained properly -benefits are not great",,
2024-12-05,"Dec 05, 2024",Indeed,,none,neutral,-0.1779,Management & Leadership; Micromanagement & Surveillance; Pay & Benefits,It's ok,Lead Care Manager,"San Diego, CA",,,,"Job is ok, pay is alright. Micromanagement is unbearable. You always feel like something is wrong there. Upper Management must be making a fortune with this amount of pressure of ticking off meaningless metrics.",
2025-01-23,"Jan 23, 2025",Indeed,,none,neutral,-0.1693,Management & Leadership; Micromanagement & Surveillance; Turnover & Retention,Would not recommend to anyone,LCM,"San Diego, CA",,,,"Great job if you need something quick but do not plan on being there more than 3 months. Turnover rate is insane, micromanagement from leadership is very intense.",
2025-02-03,"Feb 03, 2025",Glassdoor,2.0,glassdoor_overall,negative,0.2263,Micromanagement & Surveillance; Pay & Benefits; Workload & Burnout,Underpaid and overworked,Lead case manager,"San Diego, CA","Current employee, more than 1 year",Nice office but that’s about it,Constantly micromanaged and more responsibilities are given,,
2025-02-11,"Feb 11, 2025",Glassdoor,5.0,glassdoor_overall,positive,0.8834,Meaningful / Patient Work,Good Work Enviroment,Lcm,"San Ramon, CA","Former employee, less than 1 year",Members are pretty collaborative and ready to jump in to help,None that I can think of,,
2025-02-25,"Feb 25, 2025",Glassdoor,2.0,glassdoor_overall,negative,0.4226,Communication & Organization; Meaningful / Patient Work,Not great at providing,Anonymous employee,,Current employee,getting experience working with mental health clients,opened a location and accepted clients without it being fully established. - company basically ignores simple requests for better quality of care - company's communication with staff is inconsistent,,
2025-02-26,"Feb 26, 2025",Glassdoor,1.0,glassdoor_overall,negative,0.807,Micromanagement & Surveillance; Pay & Benefits; Career Growth & Advancement; Turnover & Retention; Coworkers & Team; Meaningful / Patient Work,Avoid Job!,Behavioral coordinator,"San Diego, CA",Former employee,No Pros given to the position. Seek elsewhere with actual career opportunities,Extreme high turnover rate. Micromanaged but great team members. Low Pay. No growth opportunities. 1 Year to apply for 401k plan,,
2025-03-10,"Mar 10, 2025",Indeed,1.0,indeed_topics,negative,0.8738,Management & Leadership; Culture & Toxicity; Training & Onboarding; Communication & Organization; Meaningful / Patient Work; Flexibility & Schedule,Stay away,Lead Care Manager,"San Diego, CA",,none,terrible training,"The CEO is unprofessional, those under her are the same. The nepotism is horrible. If you are related you get perks to work from home. The training is sub par. There is no structure. They have a contract to help those with Behavioral Health, Housing needs, etc. but they fall so short and are so behind. They do not take it seriously so therefore they do not train their staff with all the necessary tools to be efficient, an advocate for their clients as the contract states. Save your time, gas and headache.",
2025-03-22,"Mar 22, 2025",Indeed,1.0,indeed_topics,negative,0.4221,Management & Leadership; Micromanagement & Surveillance; Workload & Burnout; Culture & Toxicity; Communication & Organization,Do not work here,Anonymous,,,,,"The CEO fosters a toxic and unhealthy work environment, where respect, professionalism, and teamwork are lacking. There is a clear disregard for diversity and inclusion, and the treatment of employees is often unprofessional and disrespectful. Communication is ineffective, and instead of collaboration, there is a culture of micromanagement and negativity. If you’re considering working here, I would strongly advise researching the company culture beforehand. Leadership sets the tone for any organization, and in this case, it has created a workplace that is more stressful than productive. I hope to see positive changes in the future, but as of now, it’s not an environment I would recommend.",
2025-03-23,"Mar 23, 2025",Indeed,,none,positive,0.9259,Management & Leadership; Micromanagement & Surveillance; Culture & Toxicity; Turnover & Retention; Meaningful / Patient Work,Toxic micromanagement,Ecm,"San Diego, CA",,,,"Save your time and energy and look elsewhere. No-one is happy. Everyone there is either looking for another job, just started or both. The insane turnover itself speaks volumes. Its all about numbers . You feel more like a telemarketer than real care manager helping people.",
2025-03-24,"Mar 24, 2025",Indeed,1.0,indeed_topics,negative,-0.9676,Management & Leadership; Micromanagement & Surveillance; Pay & Benefits; Workload & Burnout; Culture & Toxicity; Career Growth & Advancement; Communication & Organization; Turnover & Retention; Coworkers & Team; Meaningful / Patient Work,Management is the worst and burnt out work,Community Support Lead Case Manager,"Sacramento, CA",,A few colleagues and the members you work for,"Management for sure, even HR, the pay and the mentally draining work they expect out of you for the less pay","The company is very unprofessional and management does not know how to manage a thing and never gets back to you but wants you to complete 10,000 tasks a day. They are not held accountable when they are in the wrong and will back one another for the wrong they do. There is always constant changes and last minute announcements regarding any news or days off. The pay is not what they say and will not budge. And they wonder why they get such a bad turn over from their employees and the people enrolled. Very unorganized company who is trying to grow but does not manage anything. They have clowns running the show and you are under surveillance with no consent signed or information given about it. It is mentally exhausting being in that kind of environment. No room for growth at all there.",
2025-03-27,"Mar 27, 2025",Indeed,2.2,indeed_topics,negative,-0.1403,Management & Leadership; Pay & Benefits; Meaningful / Patient Work; Flexibility & Schedule,Look elsewhere,Psychiatric Mental Health Nurse Practitioner,"Martinez, GA",,"Telehealth, flexible schedule",Too many to count,I enjoyed working with patients with complex mental health conditions. Management was horrible as well as admin. It’s not supportive at all. Pay was always late. Admin duties always delayed for some reason. Not a great work environment for a new NP.,
2025-04-03,"Apr 03, 2025",Indeed,1.0,indeed_topics,negative,0.9133,Management & Leadership; Culture & Toxicity; Meaningful / Patient Work,Most toxic environment ever!,Community Supports,"San Diego, CA",,None,Everything,"Hands down, the very worst company I've ever worked for. The lack of effective leadership is evident because they do NOT support the employees. Whenever you ask for support with a member, they ask you to email but blatantly disregard their emails so you are left unsupported. The upper leadership makes sure to push out the staff that are effective and genuinely care about their work performance and their members. The only thing they are concerned about is making your calls and do not focus on ""quality"" when it comes to helping the homeless population find housing. It's all about making sure that they can bill the various Cal-Aim programs for money. The environment is extremely fake and so is the authenticity of the leadership. If you are looking for a job where you will not be appreciated and you get constantly brushed off and lied to, this is definitely the job for you! If you are passionate about helping the homeless population find housing and you genuinely care about what you are doing, definitely don't go to this employer. They will burn you out and sour your taste for working with a disadvantaged group of people.",
2025-04-11,"Apr 11, 2025",Glassdoor,4.0,glassdoor_overall,positive,0.801,Workload & Burnout; Meaningful / Patient Work,Rewarding Position,Lead care manager,"Los Angeles, CA","Current employee, more than 1 year",Serving the underserved population has always been my passion and this role enables me to do so. The support I receive has allowed me to be successful,"It can be challenging to work with high needs individuals, but we find a way to make it work!",,
2025-04-21,"Apr 21, 2025",Indeed,1.75,indeed_topics,negative,0.9267,Management & Leadership; Pay & Benefits; Workload & Burnout; Culture & Toxicity; Turnover & Retention; Coworkers & Team; Meaningful / Patient Work,Bad supervisor,Lead Care Manager,"San Diego, CA",,,: -Healthcare company that doesn’t offer comprehensive medical insurance. -Accrued time off only but they “value” mental health and self care. I recommend joining the 21st century and offer two weeks. -Everyone on a certain supervisor’s team quits because she looks for reasons to get you in trouble instead of being a good leader. The office manager is all about positivity but is besties with the supervisor who is condescending. -The job is difficult enough. Please don’t add to the stress of the job by setting unrealistic expectations,I enjoyed my coworkers and the job felt rewarding. You will learn a lot about the healthcare system.,
2025-04-25,"Apr 25, 2025",Indeed,4.0,indeed_topics,positive,0.8586,Management & Leadership; Pay & Benefits; Coworkers & Team,Good place to work at CS,,"Staff San Diego, CA",,Great co-workers and benefits,Not enough paid holidays,"If you are organized, you can get to excel in your position. Management is not perfect; they try their best as a growing company and fast-paced environment. I have noticed that ones that struggle in their position at the company are the ones that cannot take direction or constructive criticism. Attendance is a big thing and attention to detail. Those that complain are the ones that don't like to work and don't want to learn. I love what I do.",
2025-05-09,"May 09, 2025",Indeed,1.2,indeed_topics,negative,0.9255,Management & Leadership; Pay & Benefits; Workload & Burnout; Culture & Toxicity; Career Growth & Advancement; Communication & Organization; Meaningful / Patient Work,RUN dont walk away Associate Marriage and Family,Therapist,"San Diego, CA",,"The clients. They’re the reason I stayed as long as I did. Working with them was meaningful, but they deserved clinicians who weren’t barely staying afloat","Feeling like no one cares if you're okay. There’s no room to process, reflect, or even breathe. The emotional toll adds up quickly, and support is rarely offered unless you're already in crisis","What I believe I learned: I learned how to survive in chaos and how not to treat employees. I learned that burnout is real and that protecting your boundaries and mental health is essential. Unfortunately, I did not grow as a clinician here—I spent more time surviving than developing. Management: Disorganized and reactive. Policies shift constantly, often without being communicated. Feedback feels more like blame than support, and there is little investment in your development as a professional. Questions or concerns are often brushed off, and decisions are made from the top down with little transparency. Workplace culture: Toxic. The people who last here either disengage emotionally or stop asking questions. Passion and drive are not rewarded—they’re drained. If you want to clock in, do the bare minimum, and collect a paycheck, you’ll probably be fine. But if you're hoping to learn, grow, and feel supported, this is not the place.",
2025-05-27,"May 27, 2025",Indeed,,none,positive,0.9709,Coworkers & Team; Meaningful / Patient Work,Great team,Anonymous,,,,,Good support system. They care about their employees and it is a company that cares about the community. The company values align with my own. It is a great company,
2025-06-07,"Jun 07, 2025",Glassdoor,5.0,glassdoor_overall,positive,0.7003,Pay & Benefits,Good - suggested,Accountant,Indore,"Current employee, more than 1 year",Good work environment and salary,Location is slightly far away,,
2025-07-12,"Jul 12, 2025",Indeed,,none,neutral,-0.1027,Management & Leadership; Micromanagement & Surveillance; Work Conditions & Safety,The Worst,Patient Coordinator,,,,,"/Receptionist Micromanagement all the way from the top. Do not work here. If you are currently there, run away. To top it all of the office AC does not even work. There is always issues with the restroom as well.",
2025-08-12,"Aug 12, 2025",Glassdoor,1.0,glassdoor_overall,negative,-0.6908,Micromanagement & Surveillance; Pay & Benefits,Terrible. Stay away,Anonymous employee,,"Current employee, less than 1 year",Mileage pay That’s all I can think about,Rules are always changing Not a sustainable job Burn out is real,,Stop micromanaging
2025-08-16,"Aug 16, 2025",Indeed,1.0,indeed_topics,negative,0.8946,Management & Leadership; Micromanagement & Surveillance; Pay & Benefits; Workload & Burnout; Culture & Toxicity; Training & Onboarding; Communication & Organization; Meaningful / Patient Work; Work Conditions & Safety,The Office Has Fleas as of August 2025,Lead Care Manager,"San Diego, CA",,"Staff are very nice, The people we assist are great","Management constantly pressuring LCMs on their metrics, Ignoring the community aspect of our job","A typical day at work: Answer calls, complete care plans, and follow up with members, all while navigating unclear instructions, last-minute changes, and communication breakdowns between supervisors, management, and the staffing agency. Some days included working in unsafe conditions (e.g., flea infestation) with no accommodations. What you believe you learned: How to stay adaptable and keep performing despite poor communication, lack of support, and unequal treatment. I learned to advocate for myself and others, even in an environment that discourages open feedback. Management: Overloaded supervisors due to poor scheduling. Some managers were condescending and dismissive, prioritizing metrics over employee well-being. The COO often undermined supervisors instead of providing clear direction. Workplace culture: A culture of inequality between direct hires and CSL employees, with empty claims of “everyone is equal.” Little genuine concern for staff health or morale. Communication issues were recognized internally but never addressed effectively. The hardest part of the job: Working under inconsistent and unclear leadership while being excluded from benefits and incentives that direct hires received, and dealing with unsafe work conditions. The most enjoyable part of the job: Helping members and knowing the work had a real impact on the community, even if leadership’s priorities didn’t reflect that mission.",
2025-09-12,"Sep 12, 2025",Glassdoor,1.0,glassdoor_overall,negative,0.3926,Management & Leadership; Micromanagement & Surveillance; Pay & Benefits; Culture & Toxicity,Micromanaging condescending upper management,Lcm,,"Current employee, less than 1 year",You get to help the less fortunate and the mileage reimbursement,"Micromanaging..they have cameras in the office and break room and upper management watches and tell site manager what’s going on. You have 5 tasks all due at the same and have to documented, some health companies require double documentation. The micromanaging is overkill",,To become a lead but you get 10 tasks assigned at the same time and due all at the same time
2025-09-22,"Sep 22, 2025",Indeed,2.4,indeed_topics,negative,0.966,Management & Leadership; Micromanagement & Surveillance; Turnover & Retention; Coworkers & Team; Meaningful / Patient Work,Overall good job but management ruins it,Lead Case Manager,"San Diego, CA",,Co-workers,Management,"The job itself is great, you’re always occupied, time goes by quickly, and the work is very rewarding. I genuinely love what I do. Unfortunately, management makes the experience difficult. They micromanage to an extreme level, even when you’re doing excellent work and staying on top of things, which feels unnecessary. At times, they will get you in trouble over the smallest issues, which is demotivating and, I believe, one of the main reasons people quit. You might really enjoy the job in your first week, but after a while, you start to realize how poor some of the management can be. It’s not every one of them, but a few of them have ruined the experience for me, which is disappointing because I used to love working here. Co-workers are the best part of the job though.",
2025-10-31,"Oct 31, 2025",Indeed,3.2,indeed_topics,neutral,0.959,Management & Leadership; Micromanagement & Surveillance; Workload & Burnout; Meaningful / Patient Work,Upper management micromanagement,Lead Care Manager,,,"If you’re empathetic and love helping others, this is a good field","Upper management micromanagement, they have cameras in the office for upper management to listen and watch","/Enhanced Care Manager Los Angeles, CA Upper management micromanages. Heavy case load, you have to make calls, put notes in, have in person visits with members, along with other assignments. You never really have time to help members with their requests for medical assistance (such as helping members find a pcp, dentists, accompany members to Dr appointments)",
2025-11-16,"Nov 16, 2025",Indeed,,none,neutral,-0.0799,Workload & Burnout,Accommodating but stressful,Therapist,,,,,Supervision is very helpful. They work with you if you are willing to work with them. Case Load can be a bit high in order to account for no-shows.,
